{
  "schema_version": "ai-engineer-ingestion-intent/1",
  "intent_type": "upsert_entity",
  "idempotency_key": "example:organization:acme:v1",
  "video_id": "example-video",
  "mission_id": null,
  "attempt_id": null,
  "created_at": "2026-08-29T00:00:00Z",
  "preconditions": { "identity_resolution": "accepted" },
  "payload": {
    "operations": [
      {
        "id": "org",
        "action": "upsert",
        "target": "corpus.organization",
        "conflict_columns": ["tenant_id", "slug"],
        "values": {
          "slug": "acme",
          "display_name": "Acme",
          "lifecycle_state": "active"
        }
      },
      {
        "id": "domain",
        "action": "upsert",
        "target": "corpus.organization_identifier",
        "conflict_columns": ["scheme", "value"],
        "values": {
          "organization_id": { "$ref": "org.id" },
          "scheme": "domain",
          "value": "acme.example"
        }
      }
    ]
  }
}
